post_id,user_id,title,content,hashtags,status,scheduled_at,published_at,threads_id,threads_url,impressions,likes,comments,shares,created_at
post_1704067200001,1,新商品のお知らせ,本日より新しい商品の販売を開始いたします。詳細はウェブサイトをご覧ください。,#新商品 #お知らせ #セール,published,,2024-01-08 10:00:00,t_abc123456,https://threads.net/t/abc123456,12456,856,45,123,2024-01-08 09:00:00
post_1704067200002,1,週末セール開催,週末限定で全品20%オフ！この機会をお見逃しなく。,#週末セール #限定 #20%オフ,published,,2024-01-07 15:00:00,t_def789012,https://threads.net/t/def789012,8934,623,32,89,2024-01-07 14:00:00
post_1704067200003,1,イベント告知,来週土曜日にオンラインイベントを開催します。参加無料です！,#イベント #オンライン #無料,scheduled,2024-01-13 14:00:00,,,0,0,0,0,2024-01-08 11:00:00
post_1704067200004,2,お客様の声,たくさんのご好評をいただいております。ありがとうございます！,#お客様の声 #感謝,published,,2024-01-06 10:00:00,t_ghi345678,https://threads.net/t/ghi345678,5678,234,12,45,2024-01-06 09:30:00
post_1704067200005,1,新機能リリース,システムに新機能を追加しました。より便利にご利用いただけます。,#新機能 #アップデート,draft,,,,,0,0,0,0,2024-01-08 12:00:00
post_1704067200006,1,営業時間変更のお知らせ,明日より営業時間を変更いたします。ご確認ください。,#お知らせ #営業時間,scheduled,2024-01-09 09:00:00,,,0,0,0,0,2024-01-08 13:00:00
post_1704067200007,3,テスト投稿,これはテスト投稿です。,#テスト,draft,,,,,0,0,0,0,2024-01-08 14:00:00